{
  "$schema": "http://json-schema.org/draft-07/schema#",
  "$id": "urn:rosetta:engineering.lifecycle-source.v1",
  "title": "Bounded engineering lifecycle source adapter v1",
  "type": "object",
  "additionalProperties": false,
  "required": [
    "profile",
    "bundleRef",
    "capturedAt",
    "workRef",
    "sources",
    "records",
    "validationRelations",
    "limitations"
  ],
  "properties": {
    "profile": {
      "type": "object",
      "additionalProperties": false,
      "required": [
        "id",
        "version"
      ],
      "properties": {
        "id": {
          "const": "engineering.lifecycle-source.v1"
        },
        "version": {
          "const": "1.0.0"
        }
      }
    },
    "bundleRef": {
      "type": "string",
      "minLength": 1,
      "pattern": "\\S"
    },
    "capturedAt": {
      "type": "string",
      "format": "date-time"
    },
    "workRef": {
      "type": "string",
      "minLength": 1,
      "pattern": "\\S"
    },
    "sources": {
      "type": "array",
      "minItems": 1,
      "maxItems": 256,
      "items": {
        "type": "object",
        "additionalProperties": false,
        "required": [
          "ref",
          "locator",
          "sha256",
          "role",
          "authorityClass",
          "sourceTime"
        ],
        "properties": {
          "ref": {
            "type": "string",
            "minLength": 1,
            "pattern": "\\S"
          },
          "locator": {
            "anyOf": [
              {
                "type": "string",
                "minLength": 1,
                "pattern": "\\S"
              },
              {
                "type": "null"
              }
            ]
          },
          "sha256": {
            "type": [
              "string",
              "null"
            ],
            "pattern": "^[a-f0-9]{64}$"
          },
          "role": {
            "enum": [
              "issue",
              "authority",
              "spec",
              "plan",
              "checkpoint",
              "red",
              "green",
              "hosted-verification",
              "pull-request",
              "integration",
              "executor",
              "receipt",
              "other"
            ]
          },
          "authorityClass": {
            "enum": [
              "governing-contract",
              "desired-state",
              "source-evidence",
              "implementation-evidence",
              "verification-evidence",
              "integration-evidence",
              "unknown"
            ]
          },
          "sourceTime": {
            "anyOf": [
              {
                "type": "string",
                "format": "date-time"
              },
              {
                "type": "null"
              }
            ]
          }
        }
      }
    },
    "records": {
      "type": "array",
      "minItems": 1,
      "maxItems": 64,
      "uniqueItems": true,
      "items": {
        "$ref": "urn:rosetta:work.lifecycle.v1"
      }
    },
    "validationRelations": {
      "type": "array",
      "maxItems": 64,
      "items": {
        "type": "object",
        "additionalProperties": false,
        "required": [
          "redRef",
          "greenRef",
          "implementationRef"
        ],
        "properties": {
          "redRef": {
            "type": "string",
            "minLength": 1,
            "pattern": "\\S"
          },
          "greenRef": {
            "type": "string",
            "minLength": 1,
            "pattern": "\\S"
          },
          "implementationRef": {
            "type": "string",
            "minLength": 1,
            "pattern": "\\S"
          }
        }
      }
    },
    "limitations": {
      "type": "array",
      "items": {
        "type": "string",
        "minLength": 1,
        "pattern": "\\S"
      },
      "uniqueItems": true
    }
  }
}
